<?xml version="1.0" encoding="UTF-8"?>
<cl:client xmlns:cl="http://www.solms.co.za/clients" 
    xmlns:xsi="http://www.w3.org/2001/XMLSchema-instance" 
    xsi:schemaLocation="http://www.solms.co.za/clients substitute.xsd">

  <cl:name>Jack</cl:name>
  <cl:account>
    <cl:balance>5432.12</cl:balance>
    <cl:accountNo>acc101</cl:accountNo>
  </cl:account>
  <cl:account>
    <cl:balance>5432.12</cl:balance>
    <cl:accountNo>acc101</cl:accountNo>
  </cl:account>
  <cl:account type="VISA" xsi:type="cl:CreditCardAccount">
    <cl:balance>12354</cl:balance>
    <cl:accountNo>14321</cl:accountNo>
    <cl:expiryDate>2001-01-14</cl:expiryDate>
    <cl:issuer>Investec</cl:issuer>
  </cl:account>
  <cl:account xsi:type="cl:CreditCardAccount" type="VISA">
    <cl:balance>200</cl:balance>
    <cl:accountNo>76328376</cl:accountNo>
    <cl:expiryDate></cl:expiryDate>
    <cl:issuer></cl:issuer>
  </cl:account>
  
</cl:client>
